{
  "company_full_name": "北京星辰天合科技股份有限公司",
  "stage_tag": "Pre-IPO",
  "thesis": "中国最大独立分布式 AI 存储领军者，盈利拐点已现。",
  "company_overview": {
    "summary": "北京星辰天合（XSKY）是中国领先的独立分布式 AI 存储供应商，专注破解 AI 时代 I/O 墙与内存墙瓶颈。公司凭借中立性优势适配异构芯片生态，服务超百家中国 500 强企业。2025 年前三季度在 AI 大模型需求驱动下收入爆发并首次扭亏为盈，规模效应与客户粘性双双显现。"
  },
  "pe_snapshot": {
    "stage": "Pre-IPO",
    "round_size": "未披露",
    "pre_valuation": "未披露",
    "lead_terms": "拟科创板上市，含老股转让窗口"
  },
  "cap_and_traction": {
    "shareholders": [
      { "name": "管理团队 / 创始团队", "pct": "35.2%" },
      { "name": "君联资本",           "pct": "12.8%" },
      { "name": "招商局创投",         "pct": "9.4%" },
      { "name": "其他财务投资人",     "pct": "未披露" }
    ],
    "traction": [
      { "metric": "营业收入", "value": "19,486 万元", "note": "前三季度 +65.4% YoY" },
      { "metric": "净利率",   "value": "4.2%",        "note": "由 -48.8% 转正" },
      { "metric": "NRR",      "value": "141.3%",      "note": "覆盖 102 家 500 强" }
    ]
  },
  "highlights": [
    {
      "label": "独立厂商红利",
      "desc": "市占率 10.4%，为同口径中最大独立厂商（对标华为、浪潮的全栈方案，独立厂商在异构算力时代更易被多供应商策略采纳）；这意味着 AI 基础设施扩张周期里公司将持续获得新增预算份额，长期估值锚定上抬。"
    },
    {
      "label": "盈利拐点验证",
      "desc": "2025 年前三季度收入已超 2024 全年，YoY +65.4%；净利率由 -48.8% 转正至 4.2%（行业可比公司年化拐点通常滞后 2-3 个季度），表明规模效应已穿越临界点，估值由 PS 切到 PE 的窗口期开启。"
    },
    {
      "label": "极高客户粘性",
      "desc": "NRR 141.3% 覆盖 102 家中国 500 强（行业 SaaS 普遍 NRR 110-120%）；存量客户在 AI 大模型驱动下持续扩容升级，意味着收入增长的弹性来自既有合同的自然 upsell，对销售投入要求较低，护城河更稳。"
    },
    {
      "label": "技术与生态壁垒",
      "desc": "自研 XSEA 架构 + 2026 年 AIMesh 平台，解决内存墙痛点，兼容异构芯片（对标 NetApp ONTAP、纯石科技 Purity，国内独立厂商仅 XSKY 形成同级别软件抽象层）；护城河自底层算法到生态绑定形成结构性加深。"
    }
  ],
  "risks": [
    {
      "label": "回款压力",
      "desc": "2025 年 9 月末应收账款较年初激增 208%，远超收入增速；经营现金流持续为负，若坏账风险释放将直接侵蚀利润逻辑。",
      "mitigant": "已对 Top 5 应收做单独账龄分析；建议尽调时拉单据并与对应客户访谈交叉核对。"
    },
    {
      "label": "全栈巨头竞争",
      "desc": "华为、浪潮等具备全栈 ICT 能力的非独立巨头在整体方案报价与渠道覆盖上长期施压，硬件成本波动可能挤压一体机毛利。",
      "mitigant": "公司以软件 + 异构兼容差异化突围；监控季度毛利率与硬件采购成本占比，红线 60%。"
    }
  ]
}
